{
  "$schema": "http://json-schema.org/draft-07/schema#",
  "$id": "https://aegis.dev/schema/constitution.schema.json",
  "title": "Aegis Constitution",
  "description": "The foundational identity and context of a project. This is the first file any agent reads upon entering the workspace. It answers: What is this place, and what matters here? The required fields define the universal skeleton every tool can rely on. Additional fields are permitted — the CLI and LLM may surface domain-specific context (sensitivity tiers, domain maps, cross-domain rules) that enriches governance beyond the baseline.",
  "type": "object",
  "required": ["version", "project", "tech_stack", "principles"],
  "properties": {
    "$schema": {
      "type": "string",
      "description": "Reference to the Aegis constitution schema for validation."
    },
    "version": {
      "type": "string",
      "pattern": "^\\d+\\.\\d+\\.\\d+$",
      "description": "Aegis schema version this file conforms to.",
      "examples": ["0.1.0"]
    },
    "project": {
      "type": "object",
      "description": "Core identity of the project. Required fields form the universal skeleton. Additional fields (e.g. domains, sensitivity_tiers, cross_domain_rules) are permitted for domain-specific governance.",
      "required": ["name", "purpose", "architecture"],
      "properties": {
        "name": {
          "type": "string",
          "description": "The project name.",
          "examples": ["acme-saas-platform"]
        },
        "purpose": {
          "type": "string",
          "description": "A concise statement of what this project is and why it exists. One to three sentences maximum. This anchors every decision an agent makes.",
          "examples": ["A B2B SaaS platform for inventory management, serving mid-size retail companies. Speed and reliability are prioritized over feature breadth."]
        },
        "architecture": {
          "type": "string",
          "enum": ["monolith", "monorepo", "multi_repo", "microservices", "serverless", "hybrid"],
          "description": "The high-level architectural pattern of the project."
        },
        "module_map": {
          "type": "array",
          "description": "Top-level modules or packages in the project, with their purpose and ownership boundaries. This is the organizational chart of the codebase.",
          "items": {
            "type": "object",
            "required": ["path", "purpose"],
            "properties": {
              "path": {
                "type": "string",
                "description": "Relative path from project root.",
                "examples": ["src/frontend", "services/api", "infrastructure/"]
              },
              "purpose": {
                "type": "string",
                "description": "What this module does, in one sentence."
              },
              "owner": {
                "type": "string",
                "description": "The role name (from roles/) that has primary responsibility for this module. If unset, governed by default role.",
                "examples": ["frontend", "backend", "default"]
              },
              "internal_dependencies": {
                "type": "array",
                "items": { "type": "string" },
                "description": "Other module paths this module depends on.",
                "examples": [["src/shared", "services/auth"]]
              }
            }
          }
        },
        "required_artifacts": {
          "type": "array",
          "description": "Files that must exist in the repository. Agents should create these if they are missing. These are project-level deliverables — documentation, licensing, contribution guides — that define the project's public identity and operational standards. When the project defines build_commands and quality gates with enforcement enabled, a CI workflow configuration (e.g. .github/workflows/ci.yml) is recommended as a required artifact to ensure quality gates run automatically on every push.",
          "items": {
            "type": "object",
            "required": ["path", "purpose"],
            "properties": {
              "path": {
                "type": "string",
                "description": "Relative path from project root.",
                "examples": ["README.md", "LICENSE", "CONTRIBUTING.md", ".github/workflows/ci.yml"]
              },
              "purpose": {
                "type": "string",
                "description": "What this file is for and what it should contain, in one sentence."
              },
              "source": {
                "type": "string",
                "description": "Where the content should be derived from, if applicable.",
                "examples": ["Derived from charter.md and constitution.json", "Standard MIT license text", "Runs build_commands from constitution against quality_gate flags from governance"]
              }
            }
          }
        }
      },
      "additionalProperties": true
    },
    "tech_stack": {
      "type": "object",
      "description": "The technologies in use. Agents use this to calibrate their suggestions and avoid recommending incompatible tools.",
      "required": ["languages"],
      "additionalProperties": true,
      "properties": {
        "languages": {
          "type": "array",
          "items": { "type": "string" },
          "description": "Programming languages used in this project.",
          "examples": [["typescript", "python"]]
        },
        "frameworks": {
          "type": "array",
          "items": { "type": "string" },
          "description": "Major frameworks in use.",
          "examples": [["next.js", "fastapi", "prisma"]]
        },
        "infrastructure": {
          "type": "array",
          "items": { "type": "string" },
          "description": "Infrastructure and deployment tools.",
          "examples": [["aws", "terraform", "docker", "github-actions"]]
        },
        "package_managers": {
          "type": "array",
          "items": { "type": "string" },
          "description": "Package managers used across the project.",
          "examples": [["pnpm", "pip"]]
        },
        "key_libraries": {
          "type": "array",
          "description": "Important libraries that agents should know about and prefer.",
          "items": {
            "type": "object",
            "required": ["name", "purpose"],
            "additionalProperties": true,
            "properties": {
              "name": { "type": "string" },
              "purpose": {
                "type": "string",
                "description": "What this library is used for."
              },
              "scope": {
                "type": "string",
                "description": "Which part of the codebase uses this library.",
                "examples": ["src/frontend", "global"]
              }
            }
          }
        }
      }
    },
    "principles": {
      "type": "array",
      "description": "The non-negotiable values and priorities of this project. These are the 'why behind the rules.' When an agent faces an ambiguous decision, principles are the tiebreaker.",
      "minItems": 1,
      "items": {
        "type": "object",
        "required": ["name", "statement"],
        "properties": {
          "name": {
            "type": "string",
            "description": "Short label for this principle.",
            "examples": ["reliability_first", "simplicity", "test_everything"]
          },
          "statement": {
            "type": "string",
            "description": "The principle expressed as a clear directive.",
            "examples": ["Reliability is more important than speed of delivery. Never ship something that is not thoroughly tested."]
          },
          "priority": {
            "type": "integer",
            "minimum": 1,
            "description": "Relative priority. 1 is highest. When principles conflict, lower number wins."
          }
        },
        "additionalProperties": true
      }
    },
    "build_commands": {
      "type": "object",
      "description": "Essential commands agents need to build, test, and validate the project.",
      "additionalProperties": true,
      "properties": {
        "install": { "type": "string", "examples": ["pnpm install"] },
        "build": { "type": "string", "examples": ["pnpm build"] },
        "test": { "type": "string", "examples": ["pnpm test"] },
        "lint": { "type": "string", "examples": ["pnpm lint"] },
        "typecheck": { "type": "string", "examples": ["pnpm typecheck"] },
        "dev": { "type": "string", "examples": ["pnpm dev"] },
        "custom": {
          "type": "array",
          "description": "Any additional commands agents should know about.",
          "items": {
            "type": "object",
            "required": ["name", "command", "purpose"],
            "additionalProperties": true,
            "properties": {
              "name": { "type": "string" },
              "command": { "type": "string" },
              "purpose": { "type": "string" }
            }
          }
        }
      }
    }
  },
  "additionalProperties": true
}
